Titre,Prix,Ville,Type,Secteur,Etage,Age du bien,Surface habitable,NB Salons,NB Chambres,NB Salles de Bain,Frais de syndic / mois,Description
Appartement meublé vue sur mer Martil,950 000 DH,Martil,"Appartements, à vendre",Toute la ville,6,Neuf,168,2,2,2,125,"Un Appartement dans le meilleur endroit de Martil à 2 min de la plage à pied , dans un immeuble calme (4 façades) sécurisé et propre avec une place de Parking au sous sol. L'appartement est situe au"
Appartement à vendre 60 m² à Fnideq,730 000 DH,Fnideq,"Appartements, à vendre",Toute la ville,5,1-5 ans,60,1,2,1,,"شقة رائعة للبيع بالاثاث في سكن هادئ وآمن يقع في الفنيدق على شارع باب سبتة،
تحتوي الشقة على
2 غرفة نوم
1 حمام
مطبخ
صالة كبيرة
شرفة
Un magnifique appartement à vendre m"
Appartement neuf à vendre à Californie,1 060 000 DH,Casablanca,"Appartements, à vendre",Californie,2,Neuf,71,1,2,2,300,"Appartement neuf à vendre au projet California Corner . idéalement situé à boulevard Addaouha dans une zone en plein développement , l'appartement est composé de 2 chambres dont une suite parentale,"
studio neuf à vendre à Maarif,570 000 DH,Casablanca,"Appartements, à vendre",Maarif,2,Neuf,28,1,1,1,,"Akare met en vente un studio neuf situé dans un projet neuf en cours de construction en plein coeur de Mâarif , proche de Biranzarane

Le projet est composé de 28 studios , partant de 28 à 4"
Appartement à vendre,739 000 DH,Casablanca,"Appartements, à vendre",Sbata,2,Neuf,87,1,3,2,,"Quartier :

Quartier Nasr proche de Salmia 2 est un nouveau quartier composé d'immeubles résidentiels R4

Accessibilité :
- à 5 mn de la sortie autoroute CASA MARRAKECH
- à 2 m"
apparemment,2 300 000 DH,Rabat,"Appartements, à vendre",Hay Al Farah,3,1-5 ans,107,2,2,2,200,"apparemment à vendre dans très belle endroit à rabat
de superficie 107 vue sur mer
3ème êtage avec asenceur place de garage
compose
1 suite parentale
2 chambres
2 salon"
appartement Fès centre,1 177 600 DH,Fès,"Appartements, à vendre",Centre,1,Neuf,128,1,3,1,,nous offrons un appartement haut standing a bon prix 9200dhs M2 au centre Fes champ de courses un quartier chic des Fes qui se compose de 3ch plus balcon 2 salle de bain un grand salon cuisine équipée
Appartement à vendre 51 m² à Salé,PRIX NON SPÉCIFIÉ,Salé,"Appartements, à vendre",Sala el Jadida,2,,51,1,2,1,,Salam alikoum bghit nbi3 dari marhba
appartement à vendre,800 000 DH,Agadir,"Appartements, à vendre",Tilila,1,,136,2,3,2,,appartement à vendre à hay tilila agadir 136m 2 face 1er étage
Bel appartement récemment renouvelé,440 000 DH,Casablanca,"Appartements, à vendre",Aïn Borja,1,,69,1,3,1,,"Bonjour,
Je mets en vente un bel appartement récemment renouvelé d'une superficie de 69 m2 (Plusieurs choix sont offert dans cet immeuble, aussi une cave /dépôt de 210 m2), Emplacement parfait au"
Appartement à Mohammedia,200 000 DH,Mohammedia,"Appartements, à vendre",Autre secteur,4,Neuf,,1,2,1,,"عرض متنوع من شقق ذات تصميم مميز، مكونة من 2 إلى 3 غرف و صالون إبتداءا من 20 مليون.
يقع المشروع بالقرب من مدينة المحمدية في منطقة ذات رواج إقتصادي مميز.
الولوج عبر البدال الرابط بين اللويزية وا"
Appartement 180m² en Vente à Fès,1 650 000 DH,Fès,"Appartements, à vendre",Agdal,5,Neuf,180,2,4,3,250,"Appartements NEUFS de 180m² (4 Chambres), situés sur l’avenue du Prince Héritier dans le nouveau centre ville de Fès. Nos immeubles sont bien sécurisés, avec finitions haut de gamme, marbre au sol dan"
Appartement à vendre à Mohammedia,200 000 DH,Mohammedia,"Appartements, à vendre",Autre secteur,4,Neuf,,1,3,1,,"يقع المشروع بالقرب من مدينة المحمدية في منطقة ذات رواج إقتصادي مميز.
الولوج عبر البدال الرابط بين اللويزية والطريق السيار A3 الرباط - الدار البيضاء."
Appartement H.S au prix du moyen 86m²,870 000 DH,Bouskoura,"Appartements, à vendre",Toute la ville,3,Neuf,86,1,2,1,,"RÉSIDENCE EL AMAL - Lancement de la commercialisation

Vous rêvez d'un appartement haut standing au cœur de la ville de Bouskoura ? Votre rêve devient réalité avec RÉSIDENCE EL AMAL."
Appartement à vendre 85 m² à Bouskoura,870 000 DH,Bouskoura,"Appartements, à vendre",Toute la ville,1,Neuf,85,1,3,2,,"RÉSIDENCE EL AMAL - Lancement de la commercialisation

Vous rêvez d'un appartement haut standing au cœur de la ville de Bouskoura ? Votre rêve devient réalité avec RÉSIDENCE EL AMAL."
Un investissement sûr à Bouskoura,590 000 DH,Bouskoura,"Appartements, à vendre",Toute la ville,Rez de chaussée,Neuf,59,1,2,2,,"RÉSIDENCE ELAMAL - Lancement de la commercialisation.

Vous rêvez d'un appartement haut standing au cœur de la ville de BOUSKOURA ? Votre rêve devient réalité avec RÉSIDENCE EL AMAL."
Superbe appartement 180m² en Vente à Fès,1 650 000 DH,Fès,"Appartements, à vendre",Agdal,Rez de chaussée,Neuf,180,2,3,3,300,"Très bel appartement haut standing (unité de coin) situé au rez-de-chaussée dans la résidence Chadia en face du Champ de Courses (Parc de l'Amérique latine).

Finition haut de gamme en marbre"
bel appartement bien situé,1 060 000 DH,Salé,"Appartements, à vendre",Sidi Hajji,3,11-20 ans,107,1,3,2,150,"je mets en vente un bel appartement situé à said hajji salé dans une résidence calme et sécurisée entourée par des espaces verts.

L'appartement dispose d'une surface de 107 m bien fini avec t"
Appartement à vendre 88 m² à Bouznika,580 000 DH,Bouznika,"Appartements, à vendre",Plage Oued Cherrat,Rez de chaussée,Neuf,88,1,2,1,,"Appartement à 5 min de la mer, dans petit immeuble de 6 appartements, neuf haut standing 2 chambres, placard, porte blindée, marbre au sol, peinture décorative dans toutes les pièces, cuisine équipée"
Appartement à vendre 113m² à Val Fleuri,1 600 000 DH,Casablanca,"Appartements, à vendre",Val Fleuri,4,6-10 ans,133,1,3,2,,"Ne manquez pas l'opportunité de posséder ce magnifique appartement vide situé dans le prestigieux quartier de Val Fleuri. Offrant un mélange parfait d'élégance, de confort et d'emplacement, cet appart"
Appartement 88 m² à Safi,PRIX NON SPÉCIFIÉ,Safi,"Appartements, à vendre",Hay essalam,1,Neuf,88,1,2,1,,"* R 2
* deux façade
* bien ensoleillé tt la journée
* pas de vis à vis
* terrasse (stah) séparer
* construction solide
* matériaux nobles
* double cloison
* chaque"
Appartement à vendre 72 m² à Fès,330 000 DH,Fès,"Appartements, à vendre",Narjis,2,1-5 ans,72,1,2,1,,"Appartement non meublé bien situé à vendre
2 chambres avec balcon séjour salon salle de bain une cuisine équipée
Immeuble privé 2e étage"
شقة جميلة ومشمسة,PRIX NON SPÉCIFIÉ,Fès,"Appartements, à vendre",Ouled Tayeb,1,1-5 ans,75,2,2,2,,سقة جميلة ومشمسة ومطلة على المنطقة جميلة خضراء وأمام مسجد الفرقان
شقه بحد السوالم,PRIX NON SPÉCIFIÉ,Had Soualem,"Appartements, à vendre",Toute la ville,2,Neuf,80,1,2,1,,شقه للبيع بحد السوالم العاليه
bel appartement vente belvedere,1 090 000 DH,Casablanca,"Appartements, à vendre",Belvédère,3,11-20 ans,109,1,3,2,109,"bel appartement en vente belvedere sans ascenseur avec parking
1 salon 3 chambres 1 cuisine 1 salle de bain 1 wc séparé 2 balcons
superficie 109 m²
prix très intéressant : 1 090 000 dhs
y
p"
Appartement Neuf Boujarrah,480 000 DH,Tétouan,"Appartements, à vendre",Autre secteur,2,Neuf,85,1,3,1,100,ديار بوجراح مجمع سكني يقع في قلب مدينة تطوان، يتميز بهندسة معمارية معاصرة. يتكون من مباني بخمسة طوابق مع مصعد وموقف للسيارات ، يتوفر المجمع على شقق تتراوح مساحاتها بين 85 و 155 متر مربع. كما يتوف
appartement à vendre,105 000 000 DH,Agadir,"Appartements, à vendre",El Houda,2,,81,1,2,2,,appartement à vendre à hay El houda agadir
Appartement à vendre 70 m² levalon,500 000 DH,Kénitra,"Appartements, à vendre",Al Maghrib Al Arabi,1,Neuf,70,1,2,2,,Je met en vente une appartement de luix de 70m2 a lotissements le vallon il est composé de deux chambre avec placard grand salon sijuer grand en Bell cuisine équipée deux salle de bain l'appartement
duplex à vendre,1 300 000 DH,Casablanca,"Appartements, à vendre",Hay Hassani,2,11-20 ans,177,2,4,3,200,à 15 min de morroco mall
Hamza à avenue Nakhil,2 750 000 DH,Rabat,"Appartements, à vendre",Hay Riad,4,11-20 ans,155,2,4,3,300,"Between Bonnes Affaires Immo met à la vente en exclusivité un très joli appartement

D'une superficie de 155m², cet appartement bien ensoleillé se trouve dans un immeuble calme et sécurisée e"
Appt en plein centre de hayriad,4 000 000 DH,Rabat,"Appartements, à vendre",Riyad,1,11-20 ans,220,3,4,3,300,"Between Bonnes Affaires Immo met à la vente un très joli appartement

D'une superficie de 220 m², cet appartement bien ensoleillé se trouve dans un immeuble calme et sécurisée et se compose d"
AGENCE IMMOBILIÈRE À AÏN SEBAÂ CASABLANCA,9 500 DH,Casablanca,"Appartements, à vendre",Aïn Sebaâ,1,Neuf,97,1,3,2,,"Agence immobilière spécialisée dans l'achat, la vente, la location et l'expertise de biens immobiliers résidentiels et professionnels à Casablanca et sa région.
Nos métiers :
- Intermédiation"
Charmant appt avec un prix choc,2 740 000 DH,Rabat,"Appartements, à vendre",Hay Riad,1,6-10 ans,140,2,2,2,400,"Between Bonnes Affaires Immo met à la vente un très joli appartement

D'une superficie de 140m², cet appartement bien ensoleillé se trouve dans un immeuble calme et sécurisée et se compose d"
Vente Appartement de 96 m2 à Casablanca,1 344 000 DH,Casablanca,"Appartements, à vendre",Val Fleuri,2,,96,,2,2,,"Olivier CHAVOIN

!! EXCLUSIVITÉ MILKIYA !!


Je mets en vente un bel appartement d'une superficie de 96 m² dans un immeuble de bon standing, bien entretenu, situé dans une rue calm"
appartement Hay riad,3 300 000 DH,Rabat,"Appartements, à vendre",Hay Riad,2,6-10 ans,170,1,3,3,,appartement Hay riad pour 3 chambre salon 2 étage kassaba 3 avec piscine resedence ferme
duplex à vendre,1 300 000 DH,Casablanca,"Appartements, à vendre",Hay Hassani,2,11-20 ans,177,2,4,3,200,à 15 min de morroco mall
Hamza à avenue Nakhil,2 750 000 DH,Rabat,"Appartements, à vendre",Hay Riad,4,11-20 ans,155,2,4,3,300,"Between Bonnes Affaires Immo met à la vente en exclusivité un très joli appartement

D'une superficie de 155m², cet appartement bien ensoleillé se trouve dans un immeuble calme et sécurisée e"
Appt en plein centre de hayriad,4 000 000 DH,Rabat,"Appartements, à vendre",Riyad,1,11-20 ans,220,3,4,3,300,"Between Bonnes Affaires Immo met à la vente un très joli appartement

D'une superficie de 220 m², cet appartement bien ensoleillé se trouve dans un immeuble calme et sécurisée et se compose d"
AGENCE IMMOBILIÈRE À AÏN SEBAÂ CASABLANCA,9 500 DH,Casablanca,"Appartements, à vendre",Aïn Sebaâ,1,Neuf,97,1,3,2,,"Agence immobilière spécialisée dans l'achat, la vente, la location et l'expertise de biens immobiliers résidentiels et professionnels à Casablanca et sa région.
Nos métiers :
- Intermédiation"
Charmant appt avec un prix choc,2 740 000 DH,Rabat,"Appartements, à vendre",Hay Riad,1,6-10 ans,140,2,2,2,400,"Between Bonnes Affaires Immo met à la vente un très joli appartement

D'une superficie de 140m², cet appartement bien ensoleillé se trouve dans un immeuble calme et sécurisée et se compose d"
Vente Appartement de 96 m2 à Casablanca,1 344 000 DH,Casablanca,"Appartements, à vendre",Val Fleuri,2,,96,,2,2,,"Olivier CHAVOIN

!! EXCLUSIVITÉ MILKIYA !!


Je mets en vente un bel appartement d'une superficie de 96 m² dans un immeuble de bon standing, bien entretenu, situé dans une rue calm"
appartement Hay riad,3 300 000 DH,Rabat,"Appartements, à vendre",Hay Riad,2,6-10 ans,170,1,3,3,,appartement Hay riad pour 3 chambre salon 2 étage kassaba 3 avec piscine resedence ferme
Résidence AL BARAKA,250 000 DH,Marrakech,"Appartements, à vendre",M'Hamid,4,Neuf,60,1,3,2,,"Auprès de toutes commodités un site stratégiques au quartier M'hamid (LAKOUASS).

SAKAN TENSIFT vous propose Opération ALBARAKA dont appartements logements sociaux de 50m² à 70m² de superficie"
Appartement à vendre 110 m² à Kénitra,680 000 DH,Kénitra,"Appartements, à vendre",Al Maghrib Al Arabi,Rez de chaussée,Neuf,119,1,3,2,,شقق للبيع في موقع رائع تجزئة المغرب العربي القنيطرة بالقرب من مسجيد احد تحتوي الشقة على 100متر 3 غراف صالون سيجور كوزين حمام شقق2 وجيهات مشمسة فنسون رائع جدا تمن 680000درهم قبل لتفوض
Appartement 105 m² à Kénitra,770 000 DH,Kénitra,"Appartements, à vendre",La Ville Haute,1,Neuf,115,1,3,2,,Appartements à vendre à lotissement almaghrib alarabi doux façade il est composé de 3 chambre àvec blacar en balcon en grande salon avec deux séjour. en bell cuisine équipée et deux salle de bain l'a
Appartement 123 m² à Fès,580 000 DH,Fès,"Appartements, à vendre",Route Ain Chkaf,1,21+ ans,123,2,3,2,,"Bel appartement bien ensoleillée avec 3 façades sans vis-à-vis composé de :
- Double salon sur deux façades
- 3 grandes chambres avec placards
- un grand placard
- 2 Salles de bain"
Joli appartement ensoleillée,PRIX NON SPÉCIFIÉ,Rabat,"Appartements, à vendre",Hay Riad,3,,135,2,3,3,,"appartement en Vente à Prestigia 3ème étage Il Comprend 4 chambres 2 salon cuisine équipée bundrie 3sdb place au sous-sol titré Prix de vente 2 800 000 dhs
pour plus d'informations veuillez cont"
Appartement à vendre 213 m² à Rabat,PRIX NON SPÉCIFIÉ,Rabat,"Appartements, à vendre",Hay Riad,5,Neuf,213,2,3,3,,High Immo Agence Immobilière mets en Vente une Belle appartement defaçade ensoleillée toute la journée à Hayriad d'une superfiçie de 213 m² au 5èmes étage avec vue dégagée avec grande reséption Il
Appartement à vendre 66 m² à Tanger,750 000 DH,Tanger,"Appartements, à vendre",Tanja Balia,1,Neuf,68,1,2,2,,"Les Jardins de l'Éden est une résidence fermée actuellement en cours de construction, située dans le tout nouveau quartier de Tanja Balia. Cette résidence présente de nombreux avantages, notamment :"
Appartement à vendre 90 m² à Tanger,PRIX NON SPÉCIFIÉ,Tanger,"Appartements, à vendre",Tanja Balia,2,Neuf,90,1,2,2,,"Les Jardins de l'Éden est une résidence fermée actuellement en cours de construction, située dans le tout nouveau quartier de Tanja Balia. Cette résidence présente de nombreux avantages, notamment :"
Appartement à vendre 64 m² à Casablanca,8 500 DH,Casablanca,"Appartements, à vendre",Sidi Bernoussi,4,Neuf,64,,2,,,"Résidence sécurisée avec caméras de surveillance, ascenseur, parking sous-sol, parabole collective, piscine et climatisation pré-installée.
Avec une finition de bon standing, les appartements de"
Appartement Sidi Bernoussi Résidences Al Badr,7 200 DH,Casablanca,"Appartements, à vendre",Sidi Bernoussi,Rez de chaussée,Neuf,100,,3,,,"Complexe résidentiel Al Badr est un projet moyen standing du Groupe Ikamati situé au meilleur quartier à Sidi Bernoussi proche de toutes les commodités nécessaires : Écoles privées et publiques, comme"
Appartement Riad Essalam Beni Yekhlef- Mohammedia,250 000 DH,Mohammedia,"Appartements, à vendre",Autre secteur,4,Neuf,55,,2,,,"Résidences économiques avec ascenseurs.
De 2 à 3 Chambres.
Prix : 250 000 dhs..
Livraison immédiate."
appartement bijoux,1 800 000 DH,Casablanca,"Appartements, à vendre",Belvédère,6,6-10 ans,171,2,4,2,400,A vendre un spacieux appartement dans une résidence propre et calme au 6ème étage de 3 chambres double salons deux salles de bains orientation sud vue boulevard pour plus d'informations ou visite merc
Vente Appartement de 91 m2 à Casablanca,1 275 000 DH,Casablanca,"Appartements, à vendre",Beauséjour,5,,91,,2,2,,"Olivier CHAVOIN

!! EXCLUSIVITÉ MILKIYA !!


Je mets en vente un spacieux appartement d'une superficie de 91 m² avec 26 m² de terrasse, situé dans un immeuble bien entretenu en ple"
appartement 3 façade 130 mètre,1 090 000 DH,Casablanca,"Appartements, à vendre",Aïn Borja,5,11-20 ans,134,1,3,2,100,A vendre un spacieux appartement de 3 pièces salon double salles de bains de 132 mètre au 5ème étage 3 façade très lumineux et très ensoleillé tout la journée prix négociable résidence fermée pour plu
petite appartement lux,590 000 DH,Casablanca,"Appartements, à vendre",Aïn Borja,2,1-5 ans,58,1,2,1,200,"A vendre un très joli appartement de deux pièces salon au 2ème étage dans une résidence propre avec ascenseur et garage sous sol
avec un très bon prix pour plus d'informations ou visite merci de"
appartement à ABRAJ ALFIDA,700 000 DH,Casablanca,"Appartements, à vendre",Al Fida,6,1-5 ans,67,1,2,1,200,"A vendre un très joli appartement en plein boulevard mohamed 6 dans une résidence propre sécurisée au 6 em étage orientation plaine sud résidence avec double ascenseur et place au garage, pour plus d'"
grand studio pour investisseur,650 000 DH,Casablanca,"Appartements, à vendre",Belvédère,7+,11-20 ans,100,1,1,1,200,"A vendre un spacieux studio de plus que 100 mètres au 7ème étage dans une résidence calme et propre 2 minutes de casa voyageur, arête du tramway devant la porte de la résidence, carfour au fond de la"
petit appartement drissia,480 000 DH,Casablanca,"Appartements, à vendre",Al Fida,2,11-20 ans,75,1,1,1,50,"A vendre un petite appartement sans vis à vis effacé du lycée derier marjan drissia au 2 em étage 6 apt dans l'immeuble
pour plus d'informations merci de me contacter."
Duplex à vendre 120 m² à Mohammedia,1 100 000 DH,Mohammedia,"Appartements, à vendre",Hay Al Falah,1,1-5 ans,120,2,4,2,,"Duplex Moderne et Spacieux à Vendre
Découvrez ce duplex de 110 m², tout neuf, avec 4 chambres, 2 salles de bains/douches et 2 salons. Idéalement situé, il offre un espace confortable pour votre fa"
appart 2 à 3 chambres et salon Sala AlJadida,9 000 DH,Salé,"Appartements, à vendre",Sala el Jadida,2,Neuf,85,1,2,2,1,"La résidence Belvédère se situe en plein centre de Sala El Jadida et à 10 min de Rabat, elle est composée de 5 ilots avec 5 étage et propose des appartements de 2 à 3 chambres et salon, lumineux aux e"
Appartement à vendre 121 m2,1 650 000 DH,Mohammedia,"Appartements, à vendre",Mimosas,2,1-5 ans,121,1,3,2,400,"Je mets en vente un appartement 121 m2,

dans une résidence haut standing ( ascenseur, parking sous-sol, piscine, jardin, espaces de jeux pour enfants ……. ),

avec 3 chambres, 2 sall"
تمارة حي الوفاق قرب مسجد الإمام,1 150 000 DH,Temara,"Appartements, à vendre",Wufac Erac,4,Neuf,94,1,2,2,,مرحبا بالجميع
Appartement à Quartier Mabrouka Marrakech,968 000 DH,Marrakech,"Appartements, à vendre",Mabrouka,3,11-20 ans,121,1,3,1,100,"je mets en vente une belle appartement de 121 m² au 3ème étage d'une résidence securisée avec jardin au Quartier Mabrouka à 10 min de Gueliz et de Marjane.
Cette appartement se compose de 3 chambr"
شقة للبيع في إقامة جنان الصخيرات appartement,270 000 DH,Skhirat,"Appartements, à vendre",Autre secteur,3,6-10 ans,50,1,2,1,,"أبيع شقة تقع في إقامة Jnane Skhirat بالقرب من المركز تتكون من 1صالون و 2 غرف ومطبخ وحمام. السطح ملكية مشتركة. تقع الشقة في الطابق الثالث مع وجود مصعد كهربائي. البيع بدون وسيط.

Je vends un"
Vente Appartement 3 pièces de 60 m2 à Bouskoura,470 000 DH,Bouskoura,"Appartements, à vendre",Toute la ville,1,,60,,2,1,,"Senie TSIRESITIANA

Découvrez ce spacieux appartement à vendre en face de la gare ONCF Bouskoura !

Situé au 1er étage et d'une superficie de 60 m², l'appartement est composé de deux c"
Vente Appartement 3 pièces de 60 m2 à Bouskoura,470 000 DH,Bouskoura,"Appartements, à vendre",Toute la ville,2,,60,,2,1,,"Senie TSIRESITIANA

Découvrez ce spacieux appartement à vendre en face de la gare ONCF Bouskoura !

Situé au 2ème étage et d'une superficie de 60 m², l'appartement est composé de deux"
Vente Appartement 3 pièces de 54 m2 à Casablanca,600 000 DH,Casablanca,"Appartements, à vendre",Oulfa,1,,54,,2,1,,"Senie TSIRESITIANA

Découvrez un magnifique appartement à vendre situé dans le quartier animé d'Oulfa !

Idéal pour les familles et les investisseurs, cet appartement charmant offre un"
Grand Appartement au centre de Bouznika,760 000 DH,Bouznika,"Appartements, à vendre",Autre secteur,1,Neuf,131,2,4,2,,"شقق رائعة في وسط المدينة بالقرب من محطة القطار ب 5 دقائق فقط متكونة من 4 غرف , 2 شرفات، مطبخ مجهز ، 2 حمامات بواجهة مشمشة
Appartement de 04 chambres, salon, cuisine bien équipée , 02 balcons et 0"
Vente Appartement 3 pièces de 60 m2 à Bouskoura,470 000 DH,Bouskoura,"Appartements, à vendre",Toute la ville,1,,60,,2,1,,"Senie TSIRESITIANA

Découvrez ce spacieux appartement à vendre en face de la gare ONCF Bouskoura !

Situé au 1er étage et d'une superficie de 60 m², l'appartement est composé de deux c"
Vente Appartement 3 pièces de 60 m2 à Bouskoura,470 000 DH,Bouskoura,"Appartements, à vendre",Toute la ville,2,,60,,2,1,,"Senie TSIRESITIANA

Découvrez ce spacieux appartement à vendre en face de la gare ONCF Bouskoura !

Situé au 2ème étage et d'une superficie de 60 m², l'appartement est composé de deux"
Vente Appartement 3 pièces de 54 m2 à Casablanca,600 000 DH,Casablanca,"Appartements, à vendre",Oulfa,1,,54,,2,1,,"Senie TSIRESITIANA

Découvrez un magnifique appartement à vendre situé dans le quartier animé d'Oulfa !

Idéal pour les familles et les investisseurs, cet appartement charmant offre un"
Grand Appartement au centre de Bouznika,760 000 DH,Bouznika,"Appartements, à vendre",Autre secteur,1,Neuf,131,2,4,2,,"شقق رائعة في وسط المدينة بالقرب من محطة القطار ب 5 دقائق فقط متكونة من 4 غرف , 2 شرفات، مطبخ مجهز ، 2 حمامات بواجهة مشمشة
Appartement de 04 chambres, salon, cuisine bien équipée , 02 balcons et 0"
Résidence Haut Standing CHU Mohammed IV Marrakech,560 000 DH,Marrakech,"Appartements, à vendre",Amerchich,1,Neuf,60,1,1,2,,"ASSAFAA BAYT, est une société de promotion immoblière qui vous propose une résidence Haut Standing de très bonne finition avec marbre aux couloirs, salons et parties communes, une cuisine équipée, car"
Résidence Haut Standing LA SOURCE - BLV Oued ISSIL,449 500 DH,Marrakech,"Appartements, à vendre",Sakar,3,Neuf,47,1,1,1,200,"Projet Résidence LA SOUREC est une résidence Haut Standing de très bonne finition avec marbre aux couloirs, salons et parties communes, une cuisine équipée, carrelage à effet parquet dans les chambres"
حي التيسير المغرب العرابي ايت ملول اكادير,375 000 DH,Agadir,"Appartements, à vendre",Autre secteur,2,,140,1,2,1,,حي التيسير المغرب العرابي ايت ملول اكادير الطابق الثاني 2غرف وصلون و مطبخ مجهز وصخان الماء ومكيف بومبة الماء في موقع ممتاز قرب لفيلات ايت ملول شارع الحسن الثاني طريق تزنيت مرحبا
Vente Appartement 4 pièces de 158 m2 à Casabl...,2 500 000 DH,Casablanca,"Appartements, à vendre",Ferme Bretone,1,,158,,3,2,,"Mouna BOUZIL

Je mets en vente un magnifique appartement ensoleillé de 158 m² idéalement situé en plein cœur de la Ferme Bretonne, Casablanca.

Situé au 1er étage, cet appartement sédu"
Appartement à vendre 95 m² à Guich Oudaya Rabat,1 500 000 DH,Rabat,"Appartements, à vendre",Guich Oudaya,1,11-20 ans,95,1,2,1,,"A l’entrée de guiche oudaya, pas loin de aswak salam Ryad, App. Au premier étage sécurisée avec 2 façades, 95 m2, une entrée spasieuse, un salon, 2 chambre à coucher, 2 balcons, cuisine , grand sale"
Vente Appartement 3 pièces de 59 m2 à Casablanca,440 000 DH,Casablanca,"Appartements, à vendre",Aïn Sebaâ,3,,59,,2,1,,"Amina BELAHSEN

Je mets en vente un bel appartement d'une superficie de 59 m² à Aïn Sebaâ, Casablanca.

Situé au 3ème étage, cet appartement propose d'un salon, de deux chambres, d'une"
Vente Appartement 1 pièces de 267 m2 à Casabl...,3 300 000 DH,Casablanca,"Appartements, à vendre",Gauthier,4,,267,,3,2,,"Chakib BELKHOU

!! EXCLUSIVITÉ MILKIYA !!


Je mets en vente un magnifique appartement spacieux d'une superficie de 267 m² à Gauthier, Casablanca.

Situé au 4ème étage, il"
Appartement 53 m² à El Jadida,290 000 DH,El Jadida,"Appartements, à vendre",Autre secteur,1,1-5 ans,53,1,2,1,50,Apparemment en vente 1er étage hay matar près la mousque MSSala 2 chambres salon séjour cuisine sdb balcon et près toutes les commodités
vente appartement farah salam oulfa,320 000 DH,Casablanca,"Appartements, à vendre",Oulfa,1,1-5 ans,50,1,2,1,50,vente appartement farah salam oulfa en 1 ème étage bien aménagé immeuble propre sécurisé ensoleillé pour plus d'informations veuillez appeler l'agence immobilière
